{
  "version": 1,
  "id": "00000000-0000-0000-0000-000000000001",
  "createdAt": "2024-01-01T00:00:00.000Z",
  "device": {
    "model": "iPhone 15 Pro",
    "iosVersion": "17.0",
    "hasLiDAR": true,
    "screen": { "width": 393, "height": 852, "scale": 3 }
  },
  "pose": [
    {
      "t": 0,
      "p": [0.0, 0.0, 0.0],
      "q": [0.0, 0.0, 0.0, 1.0],
      "tracking": "normal"
    },
    {
      "t": 16,
      "p": [0.01, 0.0, -0.005],
      "q": [0.0, 0.0, 0.0, 1.0],
      "tracking": "normal"
    }
  ],
  "imu": [
    {
      "t": 0,
      "a": [0.0, -9.81, 0.0],
      "ua": [0.0, 0.0, 0.0],
      "rr": [0.0, 0.0, 0.0],
      "qi": [0.0, 0.0, 0.0, 1.0]
    },
    {
      "t": 10,
      "a": [0.01, -9.81, 0.0],
      "ua": [0.01, 0.0, 0.0],
      "rr": [0.001, 0.0, 0.0],
      "qi": [0.0, 0.0, 0.0, 1.0]
    }
  ],
  "touches": [
    { "t": 100, "kind": "start", "id": 0, "x": 0.5, "y": 0.5 },
    { "t": 200, "kind": "end", "id": 0, "x": 0.5, "y": 0.5 }
  ],
  "markers": [
    { "t": 0, "label": "start" }
  ],
  "duration": 16
}
